================================================================================
🧪 V1 vs V2 DIFFERENTIATION TEST - Route 4 Deep Reasoning
================================================================================
V1 Group: invoice-contract-verification
V2 Group: test-5pdfs-v2-knn-disabled
Questions: 5

Initializing V1 pipeline...
2026-01-30 10:00:47 [info     ] async_neo4j_service_configured
2026-01-30 10:00:47 [info     ] router_initialized             drift_threshold=0.75 global_threshold=0.5 profile=general_enterprise vector_threshold=0.25
2026-01-30 10:00:47 [info     ] community_matcher_created      group_id=invoice-contract-verification has_embedding_client=False has_neo4j_service=True
2026-01-30 10:00:47 [info     ] hub_extractor_created          group_id=invoice-contract-verification has_graph_store=False has_neo4j=False
2026-01-30 10:00:47 [info     ] hybrid_pipeline_initialized    group_id=invoice-contract-verification has_async_neo4j=True has_community_matcher=False has_hipporag=False has_neo4j=False profile=general_enterprise relevance_budget=0.8
2026-01-30 10:00:50 [info     ] async_neo4j_connected
Initializing V2 pipeline...
2026-01-30 10:00:50 [info     ] async_neo4j_service_configured
2026-01-30 10:00:50 [info     ] router_initialized             drift_threshold=0.75 global_threshold=0.5 profile=general_enterprise vector_threshold=0.25
2026-01-30 10:00:50 [info     ] community_matcher_created      group_id=test-5pdfs-v2-knn-disabled has_embedding_client=False has_neo4j_service=True
2026-01-30 10:00:50 [info     ] hub_extractor_created          group_id=test-5pdfs-v2-knn-disabled has_graph_store=False has_neo4j=False
2026-01-30 10:00:50 [info     ] hybrid_pipeline_initialized    group_id=test-5pdfs-v2-knn-disabled has_async_neo4j=True has_community_matcher=False has_hipporag=False has_neo4j=False profile=general_enterprise relevance_budget=0.8
2026-01-30 10:00:53 [info     ] async_neo4j_connected

================================================================================
📝 Q-DR1: Identify the vendor responsible for the vertical platform lift maintenance. Does...
================================================================================

🔵 V1 Processing...
2026-01-30 10:00:53 [info     ] route_4_drift_start            query='Identify the vendor responsible for the vertical p' response_type=summary
2026-01-30 10:00:53 [info     ] stage_4.1_query_decomposition
2026-01-30 10:00:55 [info     ] stage_4.1_complete             num_sub_questions=4
2026-01-30 10:00:55 [info     ] stage_4.2_iterative_discovery
2026-01-30 10:00:55 [info     ] processing_sub_question_1      question='Which vendor is responsible for the **vertical pla'
2026-01-30 10:00:56 [info     ] intent_disambiguation_success  dropped_count=3 query='Which vendor is responsible for the **vertical platform lift maintenance** under the terms of the **original Purchase Agreement**?' seed_entities=['original Purchase Agreement', 'Purchase Agreement']
2026-01-30 10:00:57 [warning  ] semantic_beam_no_seeds         seeds=['original Purchase Agreement', 'Purchase Agreement']
2026-01-30 10:00:57 [info     ] processing_sub_question_2      question='Where in the **original Purchase Agreement** are t'
2026-01-30 10:00:57 [info     ] intent_disambiguation_success  dropped_count=0 query='Where in the **original Purchase Agreement** are the **payment schedule terms** specified for the vendor responsible for the **vertical platform lift maintenance**, and what are those terms?' seed_entities=['Original Purchase Agreement', 'Payment Schedule Terms', 'Vendor', 'Vertical Platform Lift', 'Vertical Platform Lift Maintenance']
2026-01-30 10:00:58 [warning  ] semantic_beam_no_seeds         seeds=['Original Purchase Agreement', 'Payment Schedule Terms', 'Vendor', 'Vertical Platform Lift', 'Vertical Platform Lift Maintenance']
2026-01-30 10:00:58 [info     ] processing_sub_question_3      question='What **payment schedule** is specified on the **in'
2026-01-30 10:00:59 [info     ] intent_disambiguation_success  dropped_count=0 query='What **payment schedule** is specified on the **invoice** issued by the vendor responsible for the **vertical platform lift maintenance**?' seed_entities=['Invoice for Vertical Platform Lift Maintenance', 'Vertical Platform Lift Maintenance Vendor', 'Vertical Platform Lift Maintenance Invoice', 'Vendor Payment Schedule Clause', 'Vertical Platform Lift Maintenance Agreement']
2026-01-30 10:01:01 [warning  ] semantic_beam_no_seeds         seeds=['Invoice for Vertical Platform Lift Maintenance', 'Vertical Platform Lift Maintenance Vendor', 'Vertical Platform Lift Maintenance Invoice', 'Vendor Payment Schedule Clause', 'Vertical Platform Lift Maintenance Agreement']
2026-01-30 10:01:01 [info     ] processing_sub_question_4      question='Does the **payment schedule** on the **invoice** i'
2026-01-30 10:01:02 [info     ] intent_disambiguation_success  dropped_count=0 query='Does the **payment schedule** on the **invoice** issued by the vendor responsible for the **vertical platform lift maintenance** match the **payment schedule terms** specified in the **original Purchase Agreement**, and if not, how do they differ?' seed_entities=['Invoice', 'Vertical Platform Lift Maintenance', 'Payment Schedule', 'Payment Schedule Terms', 'Original Purchase Agreement']
2026-01-30 10:01:03 [warning  ] semantic_beam_no_seeds         seeds=['Invoice', 'Vertical Platform Lift Maintenance', 'Payment Schedule', 'Payment Schedule Terms', 'Original Purchase Agreement']
2026-01-30 10:01:03 [info     ] stage_4.2_complete             num_results=4 total_seeds=14
2026-01-30 10:01:03 [info     ] stage_4.3_consolidated_tracing_semantic_beam
2026-01-30 10:01:04 [warning  ] semantic_beam_no_seeds         seeds=['original Purchase Agreement', 'Original Purchase Agreement', 'Vertical Platform Lift Maintenance', 'Vertical Platform Lift Maintenance Vendor', 'Vendor Payment Schedule Clause', 'Purchase Agreement', 'Payment Schedule', 'Vertical Platform Lift Maintenance Invoice', 'Vertical Platform Lift Maintenance Agreement', 'Vendor', 'Invoice', 'Payment Schedule Terms', 'Invoice for Vertical Platform Lift Maintenance', 'Vertical Platform Lift']
2026-01-30 10:01:04 [info     ] stage_4.3_complete             num_evidence=14
2026-01-30 10:01:04 [info     ] stage_4.3.5_confidence_check   confidence_score=0.8558823529411764 entity_diversity=0.7647058823529411 satisfied_ratio=1.0 thin_questions=0
2026-01-30 10:01:04 [info     ] stage_4.3.6_coverage_gap_fill_start chunks_per_doc=1 domain_keywords=[] is_comprehensive=False
2026-01-30 10:01:04 [info     ] stage_4.4_synthesis
2026-01-30 10:01:04 [warning  ] no_text_store_available
2026-01-30 10:01:04 [info     ] build_cited_context_grouping   doc_keys=[] num_chunks=0 num_doc_groups=0
2026-01-30 10:01:19 [info     ] synthesis_complete             is_drift_mode=True num_citations=0 query="Identify the vendor responsible for the vertical platform lift maintenance. Does their invoice's payment schedule match the terms in the original Purchase Agreement?" response_length=5315 response_type=summary
2026-01-30 10:01:19 [info     ] stage_4.4_complete
   Score: 17% (1/6 keywords)
   Citations: 0
   Missing: ['Contoso', '$20,000', '$7,000']

🟢 V2 Processing...
2026-01-30 10:01:19 [info     ] route_4_drift_start            query='Identify the vendor responsible for the vertical p' response_type=summary
2026-01-30 10:01:19 [info     ] stage_4.1_query_decomposition
2026-01-30 10:01:21 [info     ] stage_4.1_complete             num_sub_questions=4
2026-01-30 10:01:21 [info     ] stage_4.2_iterative_discovery
2026-01-30 10:01:21 [info     ] processing_sub_question_1      question='In the context of the vertical platform lift, whic'
2026-01-30 10:01:22 [info     ] intent_disambiguation_success  dropped_count=2 query='In the context of the vertical platform lift, which vendor is identified in the original Purchase Agreement as being responsible for the lift’s ongoing maintenance, including any named company, DBA, or subcontractor?' seed_entities=['Purchase Agreement']
/anaconda/envs/azureml_py38/lib/python3.10/site-packages/torch/cuda/__init__.py:789: UserWarning: Can't initialize NVML
  warnings.warn("Can't initialize NVML")
2026-01-30 10:01:27 [info     ] v2_voyage_embedder_initialized
2026-01-30 10:01:29 [info     ] semantic_beam_trace_success    query='In the context of the vertical platform lift, whic' results=10 seeds=3
2026-01-30 10:01:29 [info     ] processing_sub_question_2      question='For that same vendor responsible for the vertical '
2026-01-30 10:01:29 [info     ] intent_disambiguation_success  dropped_count=0 query='For that same vendor responsible for the vertical platform lift maintenance, what specific payment schedule, timing, and terms are stated in the original Purchase Agreement regarding invoices for their maintenance services?' seed_entities=['Vertical Platform Lift Maintenance Vendor', 'Vertical Platform Lift Maintenance Services', 'Original Purchase Agreement', 'Maintenance Services Payment Schedule', 'Maintenance Services Invoice Terms']
2026-01-30 10:01:31 [info     ] semantic_beam_trace_success    query='For that same vendor responsible for the vertical ' results=11 seeds=10
2026-01-30 10:01:31 [info     ] processing_sub_question_3      question='for the vertical platform lift?'
2026-01-30 10:01:31 [info     ] intent_disambiguation_success  dropped_count=0 query='for the vertical platform lift?' seed_entities=[]
2026-01-30 10:01:31 [info     ] processing_sub_question_4      question='for the vertical platform lift to the original Pur'
2026-01-30 10:01:32 [info     ] intent_disambiguation_success  dropped_count=3 query='for the vertical platform lift to the original Purchase Agreement, in what ways does the payment schedule on the invoice(s) match or differ from the payment schedule and terms specified in the original Purchase Agreement for that vendor’s maintenance services?' seed_entities=['Purchase Agreement', 'original Purchase Agreement']
2026-01-30 10:01:34 [info     ] semantic_beam_trace_success    query='for the vertical platform lift to the original Pur' results=12 seeds=6
2026-01-30 10:01:34 [info     ] stage_4.2_complete             num_results=4 total_seeds=7
2026-01-30 10:01:34 [info     ] stage_4.3_consolidated_tracing_semantic_beam
2026-01-30 10:01:35 [info     ] semantic_beam_trace_success    query='Identify the vendor responsible for the vertical p' results=46 seeds=20
2026-01-30 10:01:35 [info     ] stage_4.3_complete             num_evidence=46
2026-01-30 10:01:35 [info     ] stage_4.3.5_confidence_check   confidence_score=0.75 entity_diversity=0.75 satisfied_ratio=0.75 thin_questions=1
2026-01-30 10:01:35 [info     ] stage_4.3.6_coverage_gap_fill_start chunks_per_doc=1 domain_keywords=[] is_comprehensive=False
2026-01-30 10:01:35 [info     ] stage_4.4_synthesis
2026-01-30 10:01:35 [warning  ] no_text_store_available
2026-01-30 10:01:35 [info     ] build_cited_context_grouping   doc_keys=[] num_chunks=0 num_doc_groups=0
2026-01-30 10:01:50 [info     ] synthesis_complete             is_drift_mode=True num_citations=0 query="Identify the vendor responsible for the vertical platform lift maintenance. Does their invoice's payment schedule match the terms in the original Purchase Agreement?" response_length=6662 response_type=summary
2026-01-30 10:01:50 [info     ] stage_4.4_complete
   Score: 17% (1/6 keywords)
   Citations: 0
   Missing: ['Contoso', '$20,000', '$7,000']

   ⚪ TIE (diff: +0%)

================================================================================
📝 Q-DR3: A pipe burst in the kitchen (emergency) on a Sunday. If the homeowner notifies t...
================================================================================

🔵 V1 Processing...
2026-01-30 10:01:52 [info     ] route_4_drift_start            query='A pipe burst in the kitchen (emergency) on a Sunda' response_type=summary
2026-01-30 10:01:52 [info     ] stage_4.1_query_decomposition
2026-01-30 10:01:55 [info     ] stage_4.1_complete             num_sub_questions=4
2026-01-30 10:01:55 [info     ] stage_4.2_iterative_discovery
2026-01-30 10:01:55 [info     ] processing_sub_question_1      question='are permitted for such emergency situations?'
2026-01-30 10:01:56 [info     ] intent_disambiguation_success  dropped_count=0 query='are permitted for such emergency situations?' seed_entities=[]
2026-01-30 10:01:56 [info     ] processing_sub_question_2      question='Under the Warranty terms, what deadlines or time f'
2026-01-30 10:01:56 [info     ] intent_disambiguation_success  dropped_count=2 query='Under the Warranty terms, what deadlines or time frames apply to providing notice of an emergency kitchen pipe burst that occurs on a Sunday, and does sending notice via certified mail the next day satisfy those timing requirements?' seed_entities=['Warranty', 'Warranty terms', 'Sunday']
2026-01-30 10:01:59 [warning  ] semantic_beam_no_seeds         seeds=['Warranty', 'Warranty terms', 'Sunday']
2026-01-30 10:01:59 [info     ] processing_sub_question_3      question='Under the Warranty terms, are there any specific r'
2026-01-30 10:01:59 [info     ] intent_disambiguation_success  dropped_count=2 query='Under the Warranty terms, are there any specific requirements about when the Builder must receive or acknowledge certified mail notice for an emergency kitchen pipe burst that occurred on a Sunday, and does mailing the notice the next day meet those receipt/acknowledgment conditions?' seed_entities=['Warranty terms', 'Builder', 'Sunday']
2026-01-30 10:02:00 [warning  ] semantic_beam_no_seeds         seeds=['Warranty terms', 'Builder', 'Sunday']
2026-01-30 10:02:00 [info     ] processing_sub_question_4      question='beyond sending certified mail the next day, and wo'
2026-01-30 10:02:01 [info     ] intent_disambiguation_success  dropped_count=0 query='beyond sending certified mail the next day, and would failure to use those additional procedures affect whether the certified mail notice the next day is considered valid?' seed_entities=[]
2026-01-30 10:02:01 [info     ] stage_4.2_complete             num_results=4 total_seeds=4
2026-01-30 10:02:01 [info     ] stage_4.3_consolidated_tracing_semantic_beam
2026-01-30 10:02:01 [warning  ] semantic_beam_no_seeds         seeds=['Warranty', 'Builder', 'Sunday', 'Warranty terms']
2026-01-30 10:02:01 [info     ] stage_4.3_complete             num_evidence=4
2026-01-30 10:02:01 [info     ] stage_4.3.5_confidence_check   confidence_score=0.5666666666666667 entity_diversity=0.6666666666666666 satisfied_ratio=0.5 thin_questions=2
2026-01-30 10:02:01 [info     ] stage_4.3.6_coverage_gap_fill_start chunks_per_doc=1 domain_keywords=[] is_comprehensive=False
2026-01-30 10:02:02 [info     ] stage_4.4_synthesis
2026-01-30 10:02:02 [warning  ] no_text_store_available
2026-01-30 10:02:02 [info     ] build_cited_context_grouping   doc_keys=[] num_chunks=0 num_doc_groups=0
2026-01-30 10:02:13 [info     ] synthesis_complete             is_drift_mode=True num_citations=0 query='A pipe burst in the kitchen (emergency) on a Sunday. If the homeowner notifies the Builder via certified mail the next day, is this considered valid notice under the Warranty terms?' response_length=5697 response_type=summary
2026-01-30 10:02:13 [info     ] stage_4.4_complete
   Score: 83% (5/6 keywords)
   Citations: 0
   Missing: ['24 hours']

🟢 V2 Processing...
2026-01-30 10:02:13 [info     ] route_4_drift_start            query='A pipe burst in the kitchen (emergency) on a Sunda' response_type=summary
2026-01-30 10:02:13 [info     ] stage_4.1_query_decomposition
2026-01-30 10:02:16 [info     ] stage_4.1_complete             num_sub_questions=4
2026-01-30 10:02:16 [info     ] stage_4.2_iterative_discovery
2026-01-30 10:02:16 [info     ] processing_sub_question_1      question='Under the Warranty terms, how is “valid notice” de'
2026-01-30 10:02:16 [info     ] intent_disambiguation_success  dropped_count=1 query='Under the Warranty terms, how is “valid notice” defined when a pipe burst in the kitchen is an emergency that occurred on a Sunday, and the homeowner notified the Builder via certified mail the next day?' seed_entities=['Warranty', 'Builder']
2026-01-30 10:02:19 [info     ] semantic_beam_trace_success    query='Under the Warranty terms, how is “valid notice” de' results=15 seeds=7
2026-01-30 10:02:19 [info     ] processing_sub_question_2      question='Do the Warranty terms specify any special or diffe'
2026-01-30 10:02:20 [info     ] intent_disambiguation_success  dropped_count=0 query='Do the Warranty terms specify any special or different notice procedures or timing requirements for emergency situations, such as a pipe burst in the kitchen on a Sunday, and how do those requirements apply when the homeowner sends notice via certified mail the following day?' seed_entities=['Warranty terms', 'Warranty', 'Emergency Notice Procedures', 'Certified Mail Notice', 'Emergency Situations Clause']
2026-01-30 10:02:21 [info     ] semantic_beam_trace_success    query='Do the Warranty terms specify any special or diffe' results=21 seeds=22
2026-01-30 10:02:21 [info     ] processing_sub_question_3      question='According to the Warranty terms, are there any res'
2026-01-30 10:02:22 [info     ] intent_disambiguation_success  dropped_count=3 query='According to the Warranty terms, are there any restrictions or conditions on the method of notice—specifically certified mail—that affect whether notice about a kitchen pipe burst emergency that happened on a Sunday, sent the next day, qualifies as valid notice?' seed_entities=['Warranty terms', 'Warranty']
2026-01-30 10:02:24 [info     ] semantic_beam_trace_success    query='According to the Warranty terms, are there any res' results=19 seeds=15
2026-01-30 10:02:24 [info     ] processing_sub_question_4      question='occurred on a Sunday have any impact on the calcul'
2026-01-30 10:02:24 [info     ] intent_disambiguation_success  dropped_count=0 query='occurred on a Sunday have any impact on the calculation of deadlines or timing for valid notice when the homeowner sends notice via certified mail the next day?' seed_entities=[]
2026-01-30 10:02:24 [info     ] stage_4.2_complete             num_results=4 total_seeds=6
2026-01-30 10:02:24 [info     ] stage_4.3_consolidated_tracing_semantic_beam
2026-01-30 10:02:26 [info     ] semantic_beam_trace_success    query='A pipe burst in the kitchen (emergency) on a Sunda' results=59 seeds=17
2026-01-30 10:02:26 [info     ] stage_4.3_complete             num_evidence=59
2026-01-30 10:02:26 [info     ] stage_4.3.5_confidence_check   confidence_score=0.6666666666666665 entity_diversity=0.6666666666666666 satisfied_ratio=0.75 thin_questions=1
2026-01-30 10:02:28 [info     ] processing_sub_question_1      question='Under the Warranty terms, how is “valid notice” de'
2026-01-30 10:02:29 [info     ] intent_disambiguation_success  dropped_count=3 query='Under the Warranty terms, how is “valid notice” defined specifically for an emergency pipe burst in the kitchen that occurred on a Sunday when the homeowner notified the Builder via certified mail the following day, and does that Sunday occurrence have any impact on how deadlines or timing for such valid notice are calculated?' seed_entities=['Warranty', 'Builder']
2026-01-30 10:02:32 [info     ] semantic_beam_trace_success    query='Under the Warranty terms, how is “valid notice” de' results=15 seeds=7
2026-01-30 10:02:32 [info     ] processing_sub_question_2      question='Do the Warranty terms specify any special or diffe'
2026-01-30 10:02:32 [info     ] intent_disambiguation_success  dropped_count=4 query='Do the Warranty terms specify any special or different notice procedures or timing requirements that apply to emergency situations—specifically a pipe burst in the kitchen that occurred on a Sunday—when the homeowner sends notice via certified mail the next day, and do those provisions indicate whether the Sunday occurrence affects the calculation of deadlines or timing for valid notice?' seed_entities=['Warranty terms']
2026-01-30 10:02:34 [info     ] semantic_beam_trace_success    query='Do the Warranty terms specify any special or diffe' results=19 seeds=9
2026-01-30 10:02:34 [info     ] processing_sub_question_3      question='According to the Warranty terms, are there any res'
2026-01-30 10:02:34 [info     ] intent_disambiguation_success  dropped_count=1 query='According to the Warranty terms, are there any restrictions, conditions, or timing rules related to the method of notice—specifically certified mail—that affect whether notice about a kitchen pipe burst emergency that happened on a Sunday, sent via certified mail the next day, qualifies as valid notice, including any impact the Sunday occurrence may have on the calculation of deadlines or timing?' seed_entities=['Warranty terms']
2026-01-30 10:02:36 [info     ] semantic_beam_trace_success    query='According to the Warranty terms, are there any res' results=19 seeds=9
2026-01-30 10:02:37 [info     ] semantic_beam_trace_success    query='A pipe burst in the kitchen (emergency) on a Sunda' results=32 seeds=16
2026-01-30 10:02:37 [info     ] stage_4.3.5_complete           additional_seeds=3 total_evidence=59
2026-01-30 10:02:37 [info     ] stage_4.3.6_coverage_gap_fill_start chunks_per_doc=1 domain_keywords=[] is_comprehensive=False
2026-01-30 10:02:37 [info     ] stage_4.4_synthesis
2026-01-30 10:02:37 [warning  ] no_text_store_available
2026-01-30 10:02:37 [info     ] build_cited_context_grouping   doc_keys=[] num_chunks=0 num_doc_groups=0
2026-01-30 10:02:59 [info     ] synthesis_complete             is_drift_mode=True num_citations=0 query='A pipe burst in the kitchen (emergency) on a Sunday. If the homeowner notifies the Builder via certified mail the next day, is this considered valid notice under the Warranty terms?' response_length=10164 response_type=summary
2026-01-30 10:02:59 [info     ] stage_4.4_complete
   Score: 67% (4/6 keywords)
   Citations: 0
   Missing: ['24 hours', 'invalid']

   🔴 V1 BETTER (diff: -17%)

================================================================================
📝 Q-DR5: Compare the strictness of the 'financial penalties' for early termination in the...
================================================================================

🔵 V1 Processing...
2026-01-30 10:03:01 [info     ] route_4_drift_start            query="Compare the strictness of the 'financial penalties" response_type=summary
2026-01-30 10:03:01 [info     ] stage_4.1_query_decomposition
2026-01-30 10:03:03 [info     ] stage_4.1_complete             num_sub_questions=5
2026-01-30 10:03:03 [info     ] stage_4.2_iterative_discovery
2026-01-30 10:03:03 [info     ] processing_sub_question_1      question='In the Property Management Agreement, what specifi'
2026-01-30 10:03:04 [info     ] intent_disambiguation_success  dropped_count=0 query='In the Property Management Agreement, what specific "financial penalties" are imposed for early termination, and how are the amounts, calculations, and conditions for these early termination financial penalties defined?' seed_entities=['Property Management Agreement', 'Early Termination', 'Financial Penalties', 'Early Termination Fee', 'Liquidated Damages']
2026-01-30 10:03:06 [warning  ] semantic_beam_no_seeds         seeds=['Property Management Agreement', 'Early Termination', 'Financial Penalties', 'Early Termination Fee', 'Liquidated Damages']
2026-01-30 10:03:06 [info     ] processing_sub_question_2      question='In the Holding Tank Servicing Contract, what speci'
2026-01-30 10:03:07 [info     ] intent_disambiguation_success  dropped_count=4 query='In the Holding Tank Servicing Contract, what specific "financial penalties" are imposed for early termination, and how are the amounts, calculations, and conditions for these early termination financial penalties defined?' seed_entities=['Holding Tank Servicing Contract']
2026-01-30 10:03:08 [warning  ] semantic_beam_no_seeds         seeds=['Holding Tank Servicing Contract']
2026-01-30 10:03:08 [info     ] processing_sub_question_3      question='do the early termination "financial penalties" app'
2026-01-30 10:03:10 [info     ] intent_disambiguation_success  dropped_count=0 query='do the early termination "financial penalties" apply in the Property Management Agreement, and how do these circumstances affect the strictness of those penalties?' seed_entities=['Property Management Agreement', 'Early Termination', 'Financial Penalties']
2026-01-30 10:03:11 [warning  ] semantic_beam_no_seeds         seeds=['Property Management Agreement', 'Early Termination', 'Financial Penalties']
2026-01-30 10:03:11 [info     ] processing_sub_question_4      question='do the early termination "financial penalties" app'
2026-01-30 10:03:12 [info     ] intent_disambiguation_success  dropped_count=0 query='do the early termination "financial penalties" apply in the Holding Tank Servicing Contract, and how do these circumstances affect the strictness of those penalties?' seed_entities=['Holding Tank Servicing Contract', 'Early Termination Financial Penalties']
2026-01-30 10:03:13 [warning  ] semantic_beam_no_seeds         seeds=['Holding Tank Servicing Contract', 'Early Termination Financial Penalties']
2026-01-30 10:03:13 [info     ] processing_sub_question_5      question='Comparing the two contracts directly, in what ways'
2026-01-30 10:03:13 [info     ] intent_disambiguation_success  dropped_count=3 query='Comparing the two contracts directly, in what ways are the "financial penalties" for early termination in the Property Management Agreement stricter, less strict, or comparable to those in the Holding Tank Servicing Contract, considering factors such as penalty amounts, calculation methods, notice requirements, and conditions under which the penalties are waived or enforced?' seed_entities=['Property Management Agreement', 'Holding Tank Servicing Contract']
2026-01-30 10:03:14 [warning  ] semantic_beam_no_seeds         seeds=['Property Management Agreement', 'Holding Tank Servicing Contract']
2026-01-30 10:03:14 [info     ] stage_4.2_complete             num_results=5 total_seeds=7
2026-01-30 10:03:14 [info     ] stage_4.3_consolidated_tracing_semantic_beam
2026-01-30 10:03:15 [warning  ] semantic_beam_no_seeds         seeds=['Early Termination Financial Penalties', 'Early Termination', 'Early Termination Fee', 'Financial Penalties', 'Property Management Agreement', 'Holding Tank Servicing Contract', 'Liquidated Damages']
2026-01-30 10:03:15 [info     ] stage_4.3_complete             num_evidence=7
2026-01-30 10:03:15 [info     ] stage_4.3.5_confidence_check   confidence_score=0.5953846153846154 entity_diversity=0.5384615384615384 satisfied_ratio=0.8 thin_questions=1
2026-01-30 10:03:17 [info     ] processing_sub_question_1      question='In the Holding Tank Servicing Contract, what speci'
2026-01-30 10:03:18 [info     ] intent_disambiguation_success  dropped_count=0 query='In the Holding Tank Servicing Contract, what specific "financial penalties" are imposed for early termination, and how are the amounts, calculations, and conditions for these early termination financial penalties defined, taking into account all relevant circumstances that might affect the strictness of those penalties?' seed_entities=['Holding Tank Servicing Contract', 'Financial Penalties', 'Early Termination', 'Early Termination Financial Penalties', 'Termination Clause']
2026-01-30 10:03:20 [warning  ] semantic_beam_no_seeds         seeds=['Holding Tank Servicing Contract', 'Financial Penalties', 'Early Termination', 'Early Termination Financial Penalties', 'Termination Clause']
2026-01-30 10:03:20 [info     ] processing_sub_question_2      question=', and how do these similarities or differences in '
2026-01-30 10:03:20 [info     ] intent_disambiguation_success  dropped_count=0 query=', and how do these similarities or differences in circumstances affect the strictness of the early termination financial penalties?' seed_entities=[]
2026-01-30 10:03:20 [info     ] processing_sub_question_3      question='become stricter, more lenient, or inapplicable, an'
2026-01-30 10:03:21 [info     ] intent_disambiguation_success  dropped_count=0 query='become stricter, more lenient, or inapplicable, and how are these changes in strictness explicitly defined?' seed_entities=[]
2026-01-30 10:03:22 [warning  ] semantic_beam_no_seeds         seeds=['Early Termination Financial Penalties', 'Early Termination', 'Financial Penalties', 'Termination Clause', 'Holding Tank Servicing Contract']
2026-01-30 10:03:22 [info     ] stage_4.3.5_complete           additional_seeds=5 total_evidence=8
2026-01-30 10:03:22 [info     ] stage_4.3.6_coverage_gap_fill_start chunks_per_doc=5 domain_keywords=[] is_comprehensive=True
2026-01-30 10:03:22 [info     ] stage_4.3.6_using_section_based_coverage reason=comprehensive_enumeration_query
2026-01-30 10:03:22 [warning  ] stage_4.3.6_section_fallback   fallback_chunks_per_doc=15 reason=no_sections_found
2026-01-30 10:03:22 [info     ] stage_4.4_synthesis
2026-01-30 10:03:22 [warning  ] no_text_store_available
2026-01-30 10:03:22 [info     ] build_cited_context_grouping   doc_keys=[] num_chunks=0 num_doc_groups=0
2026-01-30 10:03:49 [info     ] synthesis_complete             is_drift_mode=True num_citations=0 query="Compare the strictness of the 'financial penalties' for early termination in the Property Management Agreement versus the Holding Tank Servicing Contract." response_length=14694 response_type=summary
2026-01-30 10:03:49 [info     ] stage_4.4_complete
   Score: 83% (5/6 keywords)
   Citations: 0
   Missing: ['commission']

🟢 V2 Processing...
2026-01-30 10:03:49 [info     ] route_4_drift_start            query="Compare the strictness of the 'financial penalties" response_type=summary
2026-01-30 10:03:49 [info     ] stage_4.1_query_decomposition
2026-01-30 10:03:51 [info     ] stage_4.1_complete             num_sub_questions=4
2026-01-30 10:03:51 [info     ] stage_4.2_iterative_discovery
2026-01-30 10:03:51 [info     ] processing_sub_question_1      question='In the Property Management Agreement, what specifi'
2026-01-30 10:03:52 [info     ] intent_disambiguation_success  dropped_count=0 query='In the Property Management Agreement, what specific provisions define the "financial penalties" for early termination, including how they are calculated, what amounts or formulas are used, under what circumstances they apply, and any limits or exceptions?' seed_entities=['Property Management Agreement', 'Financial Penalties', 'Early Termination', 'Termination Clause', 'Liquidated Damages']
2026-01-30 10:03:54 [info     ] semantic_beam_trace_success    query='In the Property Management Agreement, what specifi' results=10 seeds=7
2026-01-30 10:03:54 [info     ] processing_sub_question_2      question='In the Holding Tank Servicing Contract, what speci'
2026-01-30 10:03:55 [info     ] intent_disambiguation_success  dropped_count=4 query='In the Holding Tank Servicing Contract, what specific provisions define the "financial penalties" for early termination, including how they are calculated, what amounts or formulas are used, under what circumstances they apply, and any limits or exceptions?' seed_entities=['Holding Tank Servicing Contract']
2026-01-30 10:03:56 [info     ] semantic_beam_trace_success    query='In the Holding Tank Servicing Contract, what speci' results=6 seeds=1
2026-01-30 10:03:56 [info     ] processing_sub_question_3      question='Comparing the Property Management Agreement and th'
2026-01-30 10:03:56 [info     ] intent_disambiguation_success  dropped_count=0 query='Comparing the Property Management Agreement and the Holding Tank Servicing Contract, how do the amounts, formulas, or duration of the "financial penalties" for early termination differ, and which contract appears to impose a higher monetary burden on the terminating party under similar circumstances?' seed_entities=['Property Management Agreement', 'Holding Tank Servicing Contract', 'Financial Penalties', 'Early Termination', 'Termination Clause']
2026-01-30 10:03:58 [info     ] semantic_beam_trace_success    query='Comparing the Property Management Agreement and th' results=12 seeds=7
2026-01-30 10:03:58 [info     ] processing_sub_question_4      question='Taking into account both the triggering conditions'
2026-01-30 10:03:59 [info     ] intent_disambiguation_success  dropped_count=3 query='Taking into account both the triggering conditions and the monetary consequences in the Property Management Agreement and the Holding Tank Servicing Contract, which contract’s "financial penalties" for early termination can be characterized as stricter overall, and why?' seed_entities=['Property Management Agreement', 'Holding Tank Servicing Contract']
2026-01-30 10:04:00 [info     ] semantic_beam_trace_success    query='Taking into account both the triggering conditions' results=11 seeds=3
2026-01-30 10:04:00 [info     ] stage_4.2_complete             num_results=4 total_seeds=6
2026-01-30 10:04:00 [info     ] stage_4.3_consolidated_tracing_semantic_beam
2026-01-30 10:04:01 [info     ] semantic_beam_trace_success    query="Compare the strictness of the 'financial penalties" results=39 seeds=8
2026-01-30 10:04:01 [info     ] stage_4.3_complete             num_evidence=39
2026-01-30 10:04:01 [info     ] stage_4.3.5_confidence_check   confidence_score=0.6846153846153846 entity_diversity=0.46153846153846156 satisfied_ratio=1.0 thin_questions=0
2026-01-30 10:04:04 [info     ] processing_sub_question_1      question=', without treating separate sections of the Proper'
2026-01-30 10:04:05 [info     ] intent_disambiguation_success  dropped_count=0 query=', without treating separate sections of the Property Management Agreement as separate occurrences?' seed_entities=['Property Management Agreement']
2026-01-30 10:04:06 [info     ] semantic_beam_trace_success    query=', without treating separate sections of the Proper' results=10 seeds=2
2026-01-30 10:04:06 [info     ] processing_sub_question_2      question=', what distinct appearances or roles does the Prop'
2026-01-30 10:04:06 [info     ] intent_disambiguation_success  dropped_count=0 query=', what distinct appearances or roles does the Property Management Agreement have across the corpus in analyses of how the amounts, formulas, or duration of such penalties differ, and in determining which contract appears to impose a higher monetary burden on the terminating party under similar circumstances, without counting separate sections of the Property Management Agreement as distinct occurrences?' seed_entities=['Property Management Agreement']
2026-01-30 10:04:07 [info     ] semantic_beam_trace_success    query=', what distinct appearances or roles does the Prop' results=7 seeds=2
2026-01-30 10:04:08 [info     ] semantic_beam_trace_success    query="Compare the strictness of the 'financial penalties" results=20 seeds=2
2026-01-30 10:04:08 [info     ] stage_4.3.5_complete           additional_seeds=1 total_evidence=39
2026-01-30 10:04:08 [info     ] stage_4.3.6_coverage_gap_fill_start chunks_per_doc=5 domain_keywords=[] is_comprehensive=True
2026-01-30 10:04:08 [info     ] stage_4.3.6_using_section_based_coverage reason=comprehensive_enumeration_query
2026-01-30 10:04:08 [warning  ] stage_4.3.6_section_fallback   fallback_chunks_per_doc=15 reason=no_sections_found
2026-01-30 10:04:08 [info     ] stage_4.4_synthesis
2026-01-30 10:04:08 [warning  ] no_text_store_available
2026-01-30 10:04:08 [info     ] build_cited_context_grouping   doc_keys=[] num_chunks=0 num_doc_groups=0
2026-01-30 10:04:34 [info     ] synthesis_complete             is_drift_mode=True num_citations=0 query="Compare the strictness of the 'financial penalties' for early termination in the Property Management Agreement versus the Holding Tank Servicing Contract." response_length=12870 response_type=summary
2026-01-30 10:04:34 [info     ] stage_4.4_complete
   Score: 83% (5/6 keywords)
   Citations: 0
   Missing: ['commission']

   ⚪ TIE (diff: +0%)

================================================================================
📝 Q-DR7: The Purchase Contract lists specific payment milestones. Do these match the line...
================================================================================

🔵 V1 Processing...
2026-01-30 10:04:36 [info     ] route_4_drift_start            query='The Purchase Contract lists specific payment miles' response_type=summary
2026-01-30 10:04:36 [info     ] stage_4.1_query_decomposition
2026-01-30 10:04:37 [info     ] stage_4.1_complete             num_sub_questions=4
2026-01-30 10:04:37 [info     ] stage_4.2_iterative_discovery
2026-01-30 10:04:37 [info     ] processing_sub_question_1      question='What specific payment milestones are listed in the'
2026-01-30 10:04:38 [info     ] intent_disambiguation_success  dropped_count=0 query='What specific payment milestones are listed in the Purchase Contract, including their amounts and any associated conditions, that are relevant to Invoice #1256003?' seed_entities=['Purchase Contract', 'Invoice #1256003']
2026-01-30 10:04:39 [warning  ] semantic_beam_no_seeds         seeds=['Purchase Contract', 'Invoice #1256003']
2026-01-30 10:04:39 [info     ] processing_sub_question_2      question='What are the individual line items and their amoun'
2026-01-30 10:04:40 [info     ] intent_disambiguation_success  dropped_count=0 query='What are the individual line items and their amounts listed on Invoice #1256003, as well as the total amount of Invoice #1256003?' seed_entities=['Invoice #1256003']
2026-01-30 10:04:41 [warning  ] semantic_beam_no_seeds         seeds=['Invoice #1256003']
2026-01-30 10:04:41 [info     ] processing_sub_question_3      question='For each payment milestone listed in the Purchase '
2026-01-30 10:04:41 [info     ] intent_disambiguation_success  dropped_count=0 query='For each payment milestone listed in the Purchase Contract, is there a corresponding line item on Invoice #1256003 with a matching description, timing, and amount?' seed_entities=['Purchase Contract', 'Invoice #1256003']
2026-01-30 10:04:42 [warning  ] semantic_beam_no_seeds         seeds=['Purchase Contract', 'Invoice #1256003']
2026-01-30 10:04:42 [info     ] processing_sub_question_4      question='Does the sum of all payment milestones listed in t'
2026-01-30 10:04:43 [info     ] intent_disambiguation_success  dropped_count=0 query='Does the sum of all payment milestones listed in the Purchase Contract equal the total amount shown on Invoice #1256003?' seed_entities=['Purchase Contract', 'Invoice #1256003']
2026-01-30 10:04:43 [warning  ] semantic_beam_no_seeds         seeds=['Purchase Contract', 'Invoice #1256003']
2026-01-30 10:04:43 [info     ] stage_4.2_complete             num_results=4 total_seeds=2
2026-01-30 10:04:43 [info     ] stage_4.3_consolidated_tracing_semantic_beam
2026-01-30 10:04:44 [warning  ] semantic_beam_no_seeds         seeds=['Purchase Contract', 'Invoice #1256003']
2026-01-30 10:04:44 [info     ] stage_4.3_complete             num_evidence=2
2026-01-30 10:04:44 [info     ] stage_4.3.5_confidence_check   confidence_score=0.4642857142857143 entity_diversity=0.2857142857142857 satisfied_ratio=0.75 thin_questions=1
2026-01-30 10:04:46 [info     ] processing_sub_question_1      question='What are all of the individual line items listed o'
2026-01-30 10:04:47 [info     ] intent_disambiguation_success  dropped_count=0 query='What are all of the individual line items listed on Invoice #1256003 that are relevant to the payment milestones specified in the Purchase Contract, including for each line item its description, amount, and any stated conditions or timing details?' seed_entities=['Invoice #1256003', 'Purchase Contract', 'Payment Milestones']
2026-01-30 10:04:48 [warning  ] semantic_beam_no_seeds         seeds=['Invoice #1256003', 'Purchase Contract', 'Payment Milestones']
2026-01-30 10:04:48 [info     ] processing_sub_question_2      question='What is the total amount shown on Invoice #1256003'
2026-01-30 10:04:48 [info     ] intent_disambiguation_success  dropped_count=1 query='What is the total amount shown on Invoice #1256003, considering all individual line items and amounts listed on Invoice #1256003 that are relevant to the payment milestones specified in the Purchase Contract, and how is this total derived from those line items?' seed_entities=['Invoice #1256003', 'Invoice 1256003', 'Purchase Contract']
2026-01-30 10:04:49 [warning  ] semantic_beam_no_seeds         seeds=['Invoice #1256003', 'Invoice 1256003', 'Purchase Contract']
2026-01-30 10:04:50 [warning  ] semantic_beam_no_seeds         seeds=['Purchase Contract', 'Invoice #1256003', 'Invoice 1256003', 'Payment Milestones']
2026-01-30 10:04:50 [info     ] stage_4.3.5_complete           additional_seeds=4 total_evidence=4
2026-01-30 10:04:50 [info     ] stage_4.3.6_coverage_gap_fill_start chunks_per_doc=1 domain_keywords=[] is_comprehensive=False
2026-01-30 10:04:50 [info     ] stage_4.4_synthesis
2026-01-30 10:04:50 [warning  ] no_text_store_available
2026-01-30 10:04:50 [info     ] build_cited_context_grouping   doc_keys=[] num_chunks=0 num_doc_groups=0
2026-01-30 10:05:06 [info     ] synthesis_complete             is_drift_mode=True num_citations=0 query='The Purchase Contract lists specific payment milestones. Do these match the line items or total on the Invoice #1256003?' response_length=8101 response_type=summary
2026-01-30 10:05:06 [info     ] stage_4.4_complete
   Score: 67% (4/6 keywords)
   Citations: 0
   Missing: ['$7,000', '$2,900']

🟢 V2 Processing...
2026-01-30 10:05:06 [info     ] route_4_drift_start            query='The Purchase Contract lists specific payment miles' response_type=summary
2026-01-30 10:05:06 [info     ] stage_4.1_query_decomposition
2026-01-30 10:05:08 [info     ] stage_4.1_complete             num_sub_questions=4
2026-01-30 10:05:08 [info     ] stage_4.2_iterative_discovery
2026-01-30 10:05:08 [info     ] processing_sub_question_1      question='What specific payment milestones are listed in the'
2026-01-30 10:05:08 [info     ] intent_disambiguation_success  dropped_count=0 query='What specific payment milestones are listed in the Purchase Contract that relate to Invoice #1256003?' seed_entities=['Purchase Contract', 'Invoice #1256003']
2026-01-30 10:05:09 [info     ] semantic_beam_trace_success    query='What specific payment milestones are listed in the' results=10 seeds=2
2026-01-30 10:05:09 [info     ] processing_sub_question_2      question='What are the individual line items and the total a'
2026-01-30 10:05:10 [info     ] intent_disambiguation_success  dropped_count=0 query='What are the individual line items and the total amount shown on Invoice #1256003?' seed_entities=['Invoice #1256003']
2026-01-30 10:05:11 [info     ] semantic_beam_trace_success    query='What are the individual line items and the total a' results=6 seeds=1
2026-01-30 10:05:11 [info     ] processing_sub_question_3      question='For each payment milestone listed in the Purchase '
2026-01-30 10:05:11 [info     ] intent_disambiguation_success  dropped_count=0 query='For each payment milestone listed in the Purchase Contract, is there a corresponding line item on Invoice #1256003 with matching amounts, descriptions, and timing?' seed_entities=['Purchase Contract', 'Invoice #1256003']
2026-01-30 10:05:12 [info     ] semantic_beam_trace_success    query='For each payment milestone listed in the Purchase ' results=10 seeds=2
2026-01-30 10:05:12 [info     ] processing_sub_question_4      question='Does the sum of all payment milestones listed in t'
2026-01-30 10:05:13 [info     ] intent_disambiguation_success  dropped_count=0 query='Does the sum of all payment milestones listed in the Purchase Contract match the total amount billed on Invoice #1256003?' seed_entities=['Purchase Contract', 'Invoice #1256003']
2026-01-30 10:05:14 [info     ] semantic_beam_trace_success    query='Does the sum of all payment milestones listed in t' results=11 seeds=2
2026-01-30 10:05:14 [info     ] stage_4.2_complete             num_results=4 total_seeds=2
2026-01-30 10:05:14 [info     ] stage_4.3_consolidated_tracing_semantic_beam
2026-01-30 10:05:15 [info     ] semantic_beam_trace_success    query='The Purchase Contract lists specific payment miles' results=44 seeds=2
2026-01-30 10:05:15 [info     ] stage_4.3_complete             num_evidence=44
2026-01-30 10:05:15 [info     ] stage_4.3.5_confidence_check   confidence_score=0.6142857142857143 entity_diversity=0.2857142857142857 satisfied_ratio=1.0 thin_questions=0
2026-01-30 10:05:17 [info     ] processing_sub_question_1      question=', what are all the distinct roles, references, and'
2026-01-30 10:05:18 [info     ] intent_disambiguation_success  dropped_count=0 query=', what are all the distinct roles, references, and appearances of the entity “Purchase Contract” that are specifically related to the payment milestones listed in the Purchase Contract that relate to Invoice #1256003 (for which 10 pieces of evidence were found)?' seed_entities=['Purchase Contract', 'Invoice #1256003', 'Invoice 1256003', 'Payment Milestones', 'Evidence #10']
2026-01-30 10:05:20 [info     ] semantic_beam_trace_success    query=', what are all the distinct roles, references, and' results=8 seeds=9
2026-01-30 10:05:20 [info     ] processing_sub_question_2      question=', how does the entity “Purchase Contract” relate t'
2026-01-30 10:05:20 [info     ] intent_disambiguation_success  dropped_count=0 query=', how does the entity “Purchase Contract” relate to the individual line items and the total amount shown on Invoice #1256003 (for which 6 pieces of evidence were found), and in what distinct ways is this relationship expressed?' seed_entities=['Purchase Contract', 'Invoice #1256003']
2026-01-30 10:05:21 [info     ] semantic_beam_trace_success    query=', how does the entity “Purchase Contract” relate t' results=8 seeds=2
2026-01-30 10:05:21 [info     ] processing_sub_question_3      question=', for each payment milestone listed in the Purchas'
2026-01-30 10:05:22 [info     ] intent_disambiguation_success  dropped_count=0 query=', for each payment milestone listed in the Purchase Contract that relates to Invoice #1256003 (for which 10 pieces of evidence were found), what distinct roles or appearances does the “Purchase Contract” have in establishing whether there is a corresponding line item on Invoice #1256003 with matching amounts, descriptions, and timing?' seed_entities=['Purchase Contract', 'Invoice #1256003']
2026-01-30 10:05:23 [info     ] semantic_beam_trace_success    query=', for each payment milestone listed in the Purchas' results=10 seeds=2
2026-01-30 10:05:24 [info     ] semantic_beam_trace_success    query='The Purchase Contract lists specific payment miles' results=18 seeds=9
2026-01-30 10:05:24 [info     ] stage_4.3.5_complete           additional_seeds=5 total_evidence=46
2026-01-30 10:05:24 [info     ] stage_4.3.6_coverage_gap_fill_start chunks_per_doc=1 domain_keywords=[] is_comprehensive=False
2026-01-30 10:05:24 [info     ] stage_4.4_synthesis
2026-01-30 10:05:24 [warning  ] no_text_store_available
2026-01-30 10:05:24 [info     ] build_cited_context_grouping   doc_keys=[] num_chunks=0 num_doc_groups=0
2026-01-30 10:05:48 [info     ] synthesis_complete             is_drift_mode=True num_citations=0 query='The Purchase Contract lists specific payment milestones. Do these match the line items or total on the Invoice #1256003?' response_length=12034 response_type=summary
2026-01-30 10:05:48 [info     ] stage_4.4_complete
   Score: 50% (3/6 keywords)
   Citations: 0
   Missing: ['$20,000', '$7,000', '$2,900']

   🔴 V1 BETTER (diff: -17%)

================================================================================
📝 CONSISTENCY: Find inconsistencies between invoice details (amounts, line items, quantities) a...
================================================================================

🔵 V1 Processing...
2026-01-30 10:05:50 [info     ] route_4_drift_start            query='Find inconsistencies between invoice details (amou' response_type=summary
2026-01-30 10:05:50 [info     ] stage_4.1_query_decomposition
2026-01-30 10:05:54 [info     ] stage_4.1_complete             num_sub_questions=4
2026-01-30 10:05:54 [info     ] stage_4.2_iterative_discovery
2026-01-30 10:05:54 [info     ] processing_sub_question_1      question='that correspond to the applicable contract terms f'
2026-01-30 10:05:55 [info     ] intent_disambiguation_success  dropped_count=0 query='that correspond to the applicable contract terms for that same customer, project, or agreement period?' seed_entities=[]
2026-01-30 10:05:55 [info     ] processing_sub_question_2      question='do not match or are not supported by the specific '
2026-01-30 10:05:55 [info     ] intent_disambiguation_success  dropped_count=0 query='do not match or are not supported by the specific items or services defined in the contract?' seed_entities=[]
2026-01-30 10:05:55 [info     ] processing_sub_question_3      question='exceed, fall short of, or otherwise conflict with '
2026-01-30 10:05:56 [info     ] intent_disambiguation_success  dropped_count=0 query='exceed, fall short of, or otherwise conflict with the quantities, limits, or minimums specified in the contract?' seed_entities=[]
2026-01-30 10:05:56 [info     ] processing_sub_question_4      question='and the corresponding contract terms for the same '
2026-01-30 10:05:56 [info     ] intent_disambiguation_success  dropped_count=0 query='and the corresponding contract terms for the same customer, project, or agreement period, what specific patterns or categories of inconsistencies can be identified (e.g., systematic overbilling of quantities, missing contracted discounts in amounts, or recurring uncontracted line items)?' seed_entities=[]
2026-01-30 10:05:56 [info     ] stage_4.2_complete             num_results=4 total_seeds=0
2026-01-30 10:05:56 [info     ] stage_4.3_consolidated_tracing_semantic_beam
2026-01-30 10:05:56 [warning  ] semantic_beam_no_seeds         seeds=[]
2026-01-30 10:05:56 [info     ] stage_4.3_complete             num_evidence=0
2026-01-30 10:05:56 [info     ] stage_4.3.5_confidence_check   confidence_score=0.4 entity_diversity=1.0 satisfied_ratio=0.0 thin_questions=4
2026-01-30 10:05:59 [info     ] processing_sub_question_1      question='For the same customer, project, or agreement perio'
2026-01-30 10:06:01 [info     ] intent_disambiguation_success  dropped_count=0 query='For the same customer, project, or agreement period, which specific billed items, charges, or invoice line items correspond to the applicable contract terms, and which ones do not clearly correspond to any applicable contract terms for that same customer, project, or agreement period?' seed_entities=['Customer Agreement', 'Project Agreement', 'Agreement Period', 'Contract Terms', 'Invoice Line Items']
2026-01-30 10:06:02 [warning  ] semantic_beam_no_seeds         seeds=['Customer Agreement', 'Project Agreement', 'Agreement Period', 'Contract Terms', 'Invoice Line Items']
2026-01-30 10:06:02 [info     ] processing_sub_question_2      question='For the same customer, project, or agreement perio'
2026-01-30 10:06:03 [info     ] intent_disambiguation_success  dropped_count=0 query='For the same customer, project, or agreement period, which billed items, charges, or invoice line items exceed, fall short of, or otherwise conflict with the quantities, limits, or minimums specified in the applicable contract terms?' seed_entities=[]
2026-01-30 10:06:03 [warning  ] semantic_beam_no_seeds         seeds=['Agreement Period', 'Customer Agreement', 'Project Agreement', 'Invoice Line Items', 'Contract Terms']
2026-01-30 10:06:03 [info     ] stage_4.3.5_complete           additional_seeds=5 total_evidence=5
2026-01-30 10:06:03 [info     ] stage_4.3.6_coverage_gap_fill_start chunks_per_doc=1 domain_keywords=[] is_comprehensive=False
2026-01-30 10:06:03 [info     ] stage_4.4_synthesis
2026-01-30 10:06:03 [warning  ] no_text_store_available
2026-01-30 10:06:03 [info     ] build_cited_context_grouping   doc_keys=[] num_chunks=0 num_doc_groups=0
2026-01-30 10:06:19 [info     ] synthesis_complete             is_drift_mode=True num_citations=0 query='Find inconsistencies between invoice details (amounts, line items, quantities) and contract terms' response_length=9126 response_type=summary
2026-01-30 10:06:19 [info     ] stage_4.4_complete
   Score: 50% (3/6 keywords)
   Citations: 0
   Missing: ['payment', 'due', 'mismatch']

🟢 V2 Processing...
2026-01-30 10:06:19 [info     ] route_4_drift_start            query='Find inconsistencies between invoice details (amou' response_type=summary
2026-01-30 10:06:19 [info     ] stage_4.1_query_decomposition
2026-01-30 10:06:22 [info     ] stage_4.1_complete             num_sub_questions=5
2026-01-30 10:06:22 [info     ] stage_4.2_iterative_discovery
2026-01-30 10:06:22 [info     ] processing_sub_question_1      question='specified in each invoice, and how are these detai'
2026-01-30 10:06:22 [info     ] intent_disambiguation_success  dropped_count=0 query='specified in each invoice, and how are these details represented or stored for comparison with the corresponding contract terms?' seed_entities=['Invoice', 'Contract Terms']
2026-01-30 10:06:24 [info     ] semantic_beam_trace_success    query='specified in each invoice, and how are these detai' results=9 seeds=4
2026-01-30 10:06:24 [info     ] processing_sub_question_2      question=', and quantities, and how are these terms represen'
2026-01-30 10:06:24 [info     ] intent_disambiguation_success  dropped_count=0 query=', and quantities, and how are these terms represented or stored for comparison with the corresponding invoice details?' seed_entities=[]
2026-01-30 10:06:24 [info     ] processing_sub_question_3      question='between these invoice amounts and the contract amo'
2026-01-30 10:06:25 [info     ] intent_disambiguation_success  dropped_count=0 query='between these invoice amounts and the contract amounts?' seed_entities=[]
2026-01-30 10:06:25 [info     ] processing_sub_question_4      question='compare to the corresponding line items specified '
2026-01-30 10:06:25 [info     ] intent_disambiguation_success  dropped_count=0 query='compare to the corresponding line items specified in the contract terms, and in which cases are there inconsistencies (e.g., missing items, extra items, mismatched item types)?' seed_entities=['Contract Terms']
2026-01-30 10:06:27 [info     ] semantic_beam_trace_success    query='compare to the corresponding line items specified ' results=10 seeds=3
2026-01-30 10:06:27 [info     ] processing_sub_question_5      question='between these invoice quantities and the contract '
2026-01-30 10:06:27 [info     ] intent_disambiguation_success  dropped_count=0 query='between these invoice quantities and the contract quantities?' seed_entities=[]
2026-01-30 10:06:27 [info     ] stage_4.2_complete             num_results=5 total_seeds=2
2026-01-30 10:06:27 [info     ] stage_4.3_consolidated_tracing_semantic_beam
2026-01-30 10:06:29 [info     ] semantic_beam_trace_success    query='Find inconsistencies between invoice details (amou' results=51 seeds=4
2026-01-30 10:06:29 [info     ] stage_4.3_complete             num_evidence=51
2026-01-30 10:06:29 [info     ] stage_4.3.5_confidence_check   confidence_score=0.5066666666666666 entity_diversity=0.6666666666666666 satisfied_ratio=0.4 thin_questions=3
2026-01-30 10:06:29 [info     ] stage_4.3.6_coverage_gap_fill_start chunks_per_doc=1 domain_keywords=[] is_comprehensive=False
2026-01-30 10:06:29 [info     ] stage_4.4_synthesis
2026-01-30 10:06:29 [warning  ] no_text_store_available
2026-01-30 10:06:29 [info     ] build_cited_context_grouping   doc_keys=[] num_chunks=0 num_doc_groups=0
2026-01-30 10:06:48 [info     ] synthesis_complete             is_drift_mode=True num_citations=0 query='Find inconsistencies between invoice details (amounts, line items, quantities) and contract terms' response_length=9793 response_type=summary
2026-01-30 10:06:48 [info     ] stage_4.4_complete
   Score: 50% (3/6 keywords)
   Citations: 0
   Missing: ['payment', 'due', 'conflict']

   ⚪ TIE (diff: +0%)

================================================================================
📊 FINAL SUMMARY
================================================================================

Question        |   V1 Score |   V2 Score |     Diff | Verdict     
----------------------------------------------------------------------
Q-DR1           |        17% |        17% |      +0% | ⚪ TIE
Q-DR3           |        83% |        67% |     -17% | 🔴 V1 BETTER
Q-DR5           |        83% |        83% |      +0% | ⚪ TIE
Q-DR7           |        67% |        50% |     -17% | 🔴 V1 BETTER
CONSISTENCY     |        50% |        50% |      +0% | ⚪ TIE
----------------------------------------------------------------------
AVERAGE         |      60.0% |      53.3% |    -6.7%

🏆 OVERALL WINNER: V1

📁 Results saved to: /afh/projects/graphrag-orchestration/bench_v1_v2_differentiation_20260130_100650.json
2026-01-30 10:06:51 [info     ] async_neo4j_closed
2026-01-30 10:06:51 [info     ] async_neo4j_closed
